{
  "schema_version": "v1",
  "project_id": "triumph-manipulator-krd-search-full-cycle-v1",
  "project_name": "Триумф — Поиск — Full Cycle v1",
  "market": "yandex_direct_ru",
  "geo": {
    "primary_region": "Краснодар",
    "geo_notes": "Операционная зона: Краснодар и Краснодарский край. Экспорт региона: Краснодарский край."
  },
  "source_pack": "triumph-manipulator",
  "search_only_scope": true,
  "campaigns": [
    {
      "campaign_id": "camp_triumph_search_full_cycle_v1",
      "campaign_name": "Триумф — Поиск — Full Cycle v1",
      "campaign_type": "search",
      "search_only_scope": true,
      "geo": {
        "primary_region": "Краснодар",
        "region_ids": [
          "Краснодарский край"
        ],
        "geo_notes": "Direct import: Краснодарский край"
      },
      "strategy": {
        "strategy_label": "manual_cpc",
        "bid_intent": "Ручное управление ставками оператором в Direct",
        "priority_tier": "S"
      },
      "schedule": {
        "enabled": false,
        "schedule_notes": "Расписание задаётся в Direct после импорта"
      },
      "device_adjustments": {
        "desktop_modifier": null,
        "tablet_modifier": null,
        "mobile_modifier": null
      },
      "campaign_negatives": {
        "keywords": [
          "вакансии",
          "работа",
          "резюме",
          "купить",
          "ремонт",
          "запчасти",
          "эвакуатор",
          "бесплатно",
          "своими руками"
        ],
        "match_type_default": "phrase"
      },
      "intent_classification": "mixed_container",
      "routing_role": "primary_search",
      "groups": [
        {
          "group_id": "grp_fc01_5ton",
          "group_name": "01 — Манипулятор 5 тонн",
          "semantic_intent": "Манипулятор 5 т - exact capability",
          "intent_tier": "S",
          "intent_type": "capability_exact",
          "keyword_cluster": {
            "intent_summary": "Запрос на манипулятор 5 т с подачей в Краснодаре и крае",
            "cluster_rules_ack": true,
            "keywords": [
              {
                "phrase": "манипулятор 5 тонн краснодар",
                "match_policy": "phrase",
                "status": "active",
                "is_primary": true
              },
              {
                "phrase": "манипулятор 5т краснодар",
                "match_policy": "phrase",
                "status": "active"
              },
              {
                "phrase": "заказать манипулятор 5 тонн",
                "match_policy": "phrase",
                "status": "active"
              },
              {
                "phrase": "манипулятор борт 5 тонн",
                "match_policy": "phrase",
                "status": "active"
              },
              {
                "phrase": "манипулятор стрела 3 тонны",
                "match_policy": "phrase",
                "status": "active"
              },
              {
                "phrase": "аренда манипулятора 5 тонн",
                "match_policy": "phrase",
                "status": "active"
              }
            ]
          },
          "group_negatives": {
            "keywords": [
              "3 тонны",
              "10 тонн",
              "автокран",
              "эвакуатор"
            ],
            "match_type_default": "phrase"
          },
          "landing_route": {
            "blueprint_id": "05-capability-5-ton",
            "landing_type": "capability",
            "final_url": "https://manipulator-triumph.ru/5-tonn.html",
            "fallback_allowed": false,
            "intent_continuity_rule": "Hero и схема борта/стрелы - 5 т, вылет 14 м",
            "intent_continuity_ack": false,
            "routing_notes": "landing-pages/05-capability-5-ton.md"
          },
          "ads": [
            {
              "ad_id": "ad_fc01_a1",
              "status": "draft",
              "headline_1": "Манипулятор 5 тонн в Краснодаре",
              "headline_2": "Борт 5 т, стрела 3 т",
              "description": "Манипулятор 5 т, вылет 14 м. Подача на объект. Расчёт по задаче.",
              "display_url": {
                "domain": "manipulator-triumph.ru",
                "path_1": "manip-5-tonn"
              },
              "landing_url": "https://manipulator-triumph.ru/5-tonn.html",
              "fastlinks": [
                {
                  "title": "Манипулятор 5 тонн",
                  "url": "https://manipulator-triumph.ru/5-tonn.html",
                  "description_1": "Борт 5 т, стрела 3 т",
                  "intent_role": "primary_capability"
                },
                {
                  "title": "Перевозка бытовок",
                  "url": "https://manipulator-triumph.ru/bytovki.html",
                  "description_1": "Установка на объекте",
                  "intent_role": "use_case_crosslink"
                },
                {
                  "title": "Доставка стройматериалов",
                  "url": "https://manipulator-triumph.ru/stroymaterialy.html",
                  "description_1": "Паллеты и блоки",
                  "intent_role": "use_case_crosslink"
                },
                {
                  "title": "Для юрлиц",
                  "url": "https://manipulator-triumph.ru/yurlic.html",
                  "description_1": "Безнал и НДС",
                  "intent_role": "b2b_crosslink"
                },
                {
                  "title": "Манипулятор-вездеход",
                  "url": "https://manipulator-triumph.ru/vezdehod.html",
                  "description_1": "Полный привод 6x6",
                  "intent_role": "capability_crosslink"
                },
                {
                  "title": "Перевозка оборудования",
                  "url": "https://manipulator-triumph.ru/oborudovanie.html",
                  "description_1": "Станки и агрегаты",
                  "intent_role": "use_case_crosslink"
                },
                {
                  "title": "Перевозка контейнеров",
                  "url": "https://manipulator-triumph.ru/konteynery.html",
                  "description_1": "Блок-контейнеры",
                  "intent_role": "use_case_crosslink"
                }
              ],
              "callouts": [
                {
                  "text": "Борт 5 т",
                  "intent_role": "capability_proof"
                },
                {
                  "text": "Вылет 14 м",
                  "intent_role": "capability_proof"
                },
                {
                  "text": "Без посредников",
                  "intent_role": "trust"
                }
              ],
              "cta_semantics": {
                "primary_cta": "call"
              },
              "keyword_alignment": {
                "primary_keyword": "манипулятор 5 тонн краснодар",
                "phrase_in_headline_1": true,
                "phrase_in_description": true
              },
              "mobile_first_readability": {
                "h1_line_break_ok": true,
                "no_stuffed_keywords": true,
                "description_scannable": true
              },
              "yandex_bold_highlight": {
                "target_query": "манипулятор 5 тонн краснодар",
                "highlight_planned_in": [
                  "headline_1",
                  "description"
                ],
                "continuation_ok": true
              }
            },
            {
              "ad_id": "ad_fc01_a2",
              "status": "draft",
              "headline_1": "Манипулятор 5т - подача на объект",
              "headline_2": "Краснодар и край",
              "description": "Заказать манипулятор 5 т. Стрела 3 т. Звонок и расчёт по адресу.",
              "display_url": {
                "domain": "manipulator-triumph.ru",
                "path_1": "manip-5-tonn"
              },
              "landing_url": "https://manipulator-triumph.ru/5-tonn.html",
              "fastlinks": [
                {
                  "title": "Манипулятор 5 тонн",
                  "url": "https://manipulator-triumph.ru/5-tonn.html",
                  "description_1": "Борт 5 т, стрела 3 т",
                  "intent_role": "primary_capability"
                },
                {
                  "title": "Перевозка бытовок",
                  "url": "https://manipulator-triumph.ru/bytovki.html",
                  "description_1": "Установка на объекте",
                  "intent_role": "use_case_crosslink"
                },
                {
                  "title": "Доставка стройматериалов",
                  "url": "https://manipulator-triumph.ru/stroymaterialy.html",
                  "description_1": "Паллеты и блоки",
                  "intent_role": "use_case_crosslink"
                },
                {
                  "title": "Для юрлиц",
                  "url": "https://manipulator-triumph.ru/yurlic.html",
                  "description_1": "Безнал и НДС",
                  "intent_role": "b2b_crosslink"
                },
                {
                  "title": "Манипулятор-вездеход",
                  "url": "https://manipulator-triumph.ru/vezdehod.html",
                  "description_1": "Полный привод 6x6",
                  "intent_role": "capability_crosslink"
                },
                {
                  "title": "Перевозка арматуры",
                  "url": "https://manipulator-triumph.ru/armatura.html",
                  "description_1": "Металл и длинномер",
                  "intent_role": "use_case_crosslink"
                },
                {
                  "title": "ФБС и ЖБИ",
                  "url": "https://manipulator-triumph.ru/fbs-zhbi.html",
                  "description_1": "Тяжёлые элементы",
                  "intent_role": "use_case_crosslink"
                }
              ],
              "callouts": [],
              "cta_semantics": {